{
  "schema_version": "mstr.software-evolution-record.v0",
  "record_id": "B017-FIXTURE-REVIEW-REPAIR-001",
  "repository_identity": {
    "repository_id": "mstr://repository-owned-fixture/calculator-cli",
    "source_class": "REPOSITORY_OWNED_FIXTURE",
    "vcs_type": "GIT"
  },
  "base_revision": "fixture-r0",
  "direction_identity": {
    "direction_id": "direction-add-safe-divide",
    "direction_kind": "FEATURE_DIRECTION",
    "source_identity": "mstr://fixture/directions/add-safe-divide",
    "content_identity": "sha256:fixture-direction-add-safe-divide-v1"
  },
  "issue_pr_identity": "mstr://fixture/pr/017",
  "visible_context_manifest": {
    "manifest_id": "b017-review-repair-after-review",
    "target_event_id": "evt-recovery-1",
    "cutoff_sequence": 30,
    "visible_artifact_ids": [
      "artifact:calculator-cli-r0",
      "artifact:direction-add-safe-divide",
      "sha256:fixture-change-r0-r1",
      "sha256:fixture-test-r1-fail",
      "sha256:fixture-review-r1"
    ],
    "visible_event_ids": [
      "evt-change-1",
      "evt-test-1",
      "evt-review-1"
    ],
    "excluded_future_event_ids": [
      "evt-recovery-1",
      "evt-test-2"
    ]
  },
  "change_events": [
    {
      "event_id": "evt-change-1",
      "sequence": 10,
      "model_visibility": "MODEL_VISIBLE",
      "before_revision": "fixture-r0",
      "after_revision": "fixture-r1",
      "change_artifact_identity": "sha256:fixture-change-r0-r1"
    }
  ],
  "test_ci_events": [
    {
      "event_id": "evt-test-1",
      "sequence": 20,
      "model_visibility": "MODEL_VISIBLE",
      "revision": "fixture-r1",
      "event_kind": "TEST",
      "result": "FAIL",
      "evidence_identity": "sha256:fixture-test-r1-fail"
    },
    {
      "event_id": "evt-test-2",
      "sequence": 50,
      "model_visibility": "FUTURE_HIDDEN",
      "revision": "fixture-r2",
      "event_kind": "TEST",
      "result": "PASS",
      "evidence_identity": "sha256:fixture-test-r2-pass"
    }
  ],
  "review_events": [
    {
      "event_id": "evt-review-1",
      "sequence": 30,
      "model_visibility": "MODEL_VISIBLE",
      "revision": "fixture-r1",
      "feedback_identity": "sha256:fixture-review-r1"
    }
  ],
  "recovery_events": [
    {
      "event_id": "evt-recovery-1",
      "sequence": 40,
      "model_visibility": "FUTURE_HIDDEN",
      "trigger_event_id": "evt-review-1",
      "action": "REPAIR",
      "resulting_revision": "fixture-r2"
    }
  ],
  "final_revision": "fixture-r2",
  "final_verifier_identity": "mstr://fixture/verifier/calculator-cli-v1",
  "future_history_boundary": {
    "boundary_id": "b017-boundary-review-repair",
    "projection_mode": "FORWARD_STEP",
    "target_event_id": "evt-recovery-1",
    "cutoff_sequence": 30,
    "final_revision_visibility": "HIDDEN",
    "future_patch_visibility": "HIDDEN",
    "future_test_result_visibility": "HIDDEN",
    "future_review_visibility": "HIDDEN"
  },
  "provenance": {
    "source_identity": "mstr://repository-owned-fixture/calculator-cli",
    "source_revision": "fixture-lineage-v1",
    "acquisition_or_fixture_identity": "mstr://fixture/software-evolution/b017-review-repair-v1",
    "lineage_status": "COMPLETE"
  },
  "rights": {
    "license_or_terms_identity": "MSTR_REPOSITORY_OWNED_FIXTURE",
    "decision": "COMPATIBLE"
  },
  "contamination_status": "CLEAR"
}
